pmid,doi,year,journal,source,title,authors,abstract,score
,10.21203/rs.3.rs-7723851/v1,2025,PPR,PPR,Ancestry-specific genetic effects on urinary 6-sulfatoxymelatonin: a multi-ancestry GWAS meta-analysis,"Żebrowska M, Zhang Z, Chuang G, Evans DS, Valliere J, Maher M, Hu J, Richmond R, Turman C, Hart JE, Lane J, Marchand LL, Wilkens L, Wielscher M, Haiman C, Cheng","<title>Abstract</title> <p>Melatonin regulates circadian rhythms, metabolism, and immunity. Its primary metabolite, 6-sulfatoxymelatonin (aMT6s), is a biomarker linked to cancer risk and metabolic disorders. However, genetic determinants of aMT6s remain poorly understood, with only one prior GWAS limited to an East Asian cohort. We conducted the first multi-ancestry genome-wide association meta-analysis of urinary aMT6s, integrating 11,744 participants from five cohorts: East Asians (Taiwan Biobank), European women (Nurses’ Health Studies), European men (MrOS), and multiethnic participants (ME",5
42020658,10.1038/s41598-026-49491-2,2026,Scientific reports,MED,Multi ancestry genome wide association meta analysis of urinary aMT6s levels.,"Żebrowska M, Zhang Z, Chuang GT, Evans DS, Valliere J, Maher M, Hu J, Richmond R, Turman C, Hart JE, Lane J, Marchand LL, Wilkens L, Wielscher M, Haiman C, Chen","Melatonin regulates circadian rhythms, metabolism, and immunity. Its primary metabolite, 6-sulfatoxymelatonin (aMT6s), is a biomarker linked to cancer risk and metabolic disorders. However, genetic determinants of aMT6s remain poorly understood, with only one prior GWAS limited to an East Asian cohort. We conducted the first multi-ancestry genome-wide association meta-analysis of urinary aMT6s, integrating 11,744 participants from five cohorts: East Asians (Taiwan Biobank), European women (Nurses' Health Studies), European men (MrOS), and multiethnic participants (MEC). aMT6s was measured from",5
39073618,10.1007/s00403-024-03217-4,2024,Archives of dermatological research,MED,Assessing the genetic associations between plasma lipidomic profiles and psoriasis vulgaris.,"Zhang M, Yu S.","Several studies have indicated a potential causal relationship between plasma standard lipids, such as high-density lipoprotein-cholesterol (HDL-C), low-density lipoprotein-cholesterol (LDL-C), triglycerides (TG), and total cholesterol (TC), and psoriasis. However, few studies have offered causal evidence of lipid species beyond these standard lipids. We conducted an analysis using a genome-wide association study (GWAS) dataset comprising 179 lipid species, including 13 types across four major categories, to identify instrumental variables (IVs) associated with plasma lipids. We utilized two G",4
41236724,10.1002/alz.70898,2025,Alzheimer's & dementia : the journal of the Alzheimer's Association,MED,"Genetic regulation of the metabolome differs by sex, Alzheimer's disease stage, and plasma biomarker status.","Eissman JM, Qiao M, Kalia V, Zerlin-Esteves M, Reyes-Dumeyer D, Piriz A, Dubey S, Nandakumar R, Lee AJ, Lantigua RA, Medrano M, Mejia DR, Honig LS, Dalgard CL, ","<h4>Introduction</h4>We investigated genetic regulators of circulating plasma metabolites to identify pathways underlying biochemical changes in clinical and biomarker-supported Alzheimer's disease (AD).<h4>Methods</h4>We computed metabolite quantitative trait loci (QTL) with whole-genome sequencing (WGS) and small molecule plasma metabolites from 229 older adults with clinical AD and 322 age-matched healthy controls. Unbiased associations between 6881 metabolites and 332,772 common genetic variants were tested, adjusted for age, sex, and both metabolomic and genomic principal components.<h4>R",4
39837327,10.1016/j.xgen.2024.100743,2025,Cell genomics,MED,Genetic mapping of serum metabolome to chronic diseases among Han Chinese.,"Cheng C, Xu F, Pan XF, Wang C, Fan J, Yang Y, Liu Y, Sun L, Liu X, Xu Y, Zhou Y, Xiao C, Gou W, Miao Z, Yuan J, Shen L, Fu Y, Sun X, Zhu Y, Chen Y, Pan A, Zhou ","Serum metabolites are potential regulators for chronic diseases. To explore the genetic regulation of metabolites and their roles in chronic diseases, we quantified 2,759 serum metabolites and performed genome-wide association studies (GWASs) among Han Chinese individuals. We identified 184 study-wide significant (p < 1.81 × 10<sup>-11</sup>) metabolite quantitative trait loci (metaboQTLs), 88.59% (163) of which were novel. Notably, we identified Asian-ancestry-specific metaboQTLs, including the SNP rs2296651 for taurocholic acid and taurochenodesoxycholic acid. Leveraging the GWAS for 37 clin",4
40220762,10.1016/j.xgen.2025.100847,2025,Cell genomics,MED,Improved genetic discovery and fine-mapping resolution through multivariate latent factor analysis of high-dimensional traits.,"Zhou F, Astle WJ, Butterworth AS, Asimit JL.","Genome-wide association studies (GWASs) of high-dimensional traits, such as blood cell or metabolic traits, often use univariate approaches, ignoring trait relationships. Biological mechanisms generating variation in high-dimensional traits can be captured parsimoniously through a GWAS of latent factors. Here, we introduce flashfmZero, a zero-correlation latent-factor-based multi-trait fine-mapping approach. In an application to 25 latent factors derived from 99 blood cell traits in the INTERVAL cohort, we show that latent factor GWASs enable the detection of signals generating sub-threshold a",4
40865610,10.1016/j.jlr.2025.100890,2025,Journal of lipid research,MED,Widespread but moderate genetic overlap between circulating polyunsaturated fatty acids and brain disorders.,"Xu H, Sun Y, Francis M, Cheng CF, Modulla NTR, Brenna JT, Chiang CWK, Ye K.","Polyunsaturated fatty acids (PUFAs) are indispensable for proper neuronal function. PUFA deficiency and imbalance have been linked to various brain disorders, including major depressive disorder (MDD) and anxiety. However, the effects of PUFAs on brain disorders remain inconclusive, and the extent of their shared genetic determinants is largely unknown. We utilized genome-wide association summary statistics from six phenotypes of circulating PUFAs (N = 114,999) and 20 brain disorders (N = 9,725-762,917). We performed genome-wide analysis for each of the 120 trait pairs. We evaluated the correl",4
41417750,10.1371/journal.pdig.0001125,2025,PLOS digital health,MED,Towards precision psychiatry: Metabolomics identifies three biological subtypes of depression.,"Ma S, Nie Z, Zhang M, Mei J, Zhou E, Hu Z, Lv H, Gong Q, Wang G, Wang H, Du B, Yang J, Liu Z.","Depression is clinically and biologically heterogeneous, mandating classification strategies for personalized medicine. This study explored depression subtypes using metabolomics data from the UK Biobank and validated the subtypes in the Whitehall II cohort. The five-step analysis included: (1) identification of distinct subtypes using non-negative matrix factorization (NMF) and four machine learning algorithms; (2) genome-wide association studies (GWAS) to examine associations across subtypes and controls; (3) comparison of clinical characteristics across subtypes; (4) development of 24 subty",4
40240424,10.1038/s41598-025-94839-9,2025,Scientific reports,MED,Plasma metabolomic signatures for copy number variants and COVID-19 risk loci in Northern Finland populations.,"De T, Coin L, Herberg J, Johnson MR, Järvelin MR.","Copy number variants (CNVs) are an important class of genomic variation known to be important for human physiology and diseases. Here we present genome-wide metabolomic signatures for CNVs in two Finnish cohorts-The Northern Finland Birth Cohort 1966 (NFBC 1966) and NFBC 1986. We have analysed and reported CNVs in over 9,300 individuals and characterised their dosage effect (CNV-metabolomic QTL) on 228 plasma lipoproteins and metabolites. We have reported reference (normal physiology) metabolomic signatures for up to ~ 2.6 million COVID-19 GWAS results from the National Institutes of Health (N",4
41705646,10.1111/dom.70565,2026,"Diabetes, obesity & metabolism",MED,Causal role of genetically predicted impairment of branched-chain amino acid catabolism on insulin secretion and insulin resistance in type 2 diabetes.,"Zhou X, Lu J, Wang Z, Cheng KK, Li GH.","<h4>Background</h4>Elevated branched-chain amino acids (BCAAs; leucine, valine, isoleucine) are linked to type 2 diabetes (T2D) risk, characterised by defective insulin secretion in pancreatic β-cell and peripheral insulin resistance. Causative interaction between BCAA metabolism and these two diabetic pathogenesis remains unclear.<h4>Methods</h4>Using publicly available datasets from the European population, we conducted a meta-analysis of genome-wide association studies (GWAS), followed by multi-trait analysis of GWAS (MTAG), to identify genetic loci associated with BCAAs and their catabolit",4
42076915,10.1002/gepi.70040,2026,Genetic epidemiology,MED,Shared and Distinct Genetic Factors Underlying Bile Acid Regulation and Intrahepatic Cholestasis of Pregnancy.,"Zhang X, Li J, Zhu H, Li L, Wang Y, Yang M, Wang L, Lan X, Wang Y, Lin Y, Zeng J, Liu P, Zhou A, Xiao H, Jin X.","Intrahepatic cholestasis of pregnancy (ICP) is a pregnancy-specific liver disorder characterized by elevated total bile acid (TBA) levels, leading to adverse maternal and fetal outcomes. While genetic factors contribute to ICP and bile acid metabolism, the underlying mechanisms remain incompletely understood, particularly in East Asian populations. We conducted a genome-wide association study (GWAS) in 13,357 pregnant women from a Chinese cohort to investigate genetic determinants of TBA levels and ICP. Meta-analysis was performed by combining our data with the Shenzhen cohort. Post-GWAS analy",4
42135028,10.7555/jbr.39.20250530,2026,Journal of biomedical research,MED,Integrative genomic and metabolomic analyses identify novel associations between mQTLs and common diseases in Han Chinese.,"Cai J, Zhang J, Fu Y, Zhu M, Zhu C, Ji C, Jin C, Ma H, Zhu M, Zhang C, Wu L, Du L, Ma H.","While prior metabolomic genome-wide association studies (mGWASs) have identified numerous metabolite quantitative trait loci (mQTLs) in European populations, their characterization in East Asians-particularly Han Chinese-remains limited. Here, we integrated genomic and metabolomic data to systematically map plasma mQTLs in Han Chinese individuals and investigated their associations with common traits and diseases. Genome-wide association study (GWAS) analyses of 846 plasma metabolites were performed in 495 Han Chinese individuals to identify mQTLs. Causal genes with robust evidence were priori",4
41603468,10.1021/acs.jproteome.5c00459,2026,Journal of proteome research,MED,A Multiomic Approach Integrating Genomic and Metabolomic Data Highlights Colorectal Cancer Pathways.,"Iliou A, Chekmeneva E, Pinto RC, Koukouzeli FE, Ntounias Y, Georgakopoulou K, Pouliou M, Agelopoulos M, Tsilidis KK, Gunter MJ, Elliott P, Griffin JL, Dehghan A",Numerous genetic variants have been identified by genome-wide association studies as being associated with colorectal cancer (CRC) risk. Metabolome-wide association analysis was performed for 187 CRC-associated genetic variants using genomic data and untargeted <sup>1</sup>H nuclear magnetic resonance urine metabolomics from 1951 Airwave Health Monitoring Study participants. We identified statistically significant associations between seven CRC single-nucleotide polymorphisms (SNPs) and urinary metabolites. This included SNPs within or close to <i>RHPN2</i> with sucrose (<i>P</i> = 1.2 × 10<su,4
40468989,10.23876/j.krcp.24.135,2026,Kidney research and clinical practice,MED,Integrated genomics and metabolomics to identify cause-specific biomarkers for chronic kidney disease in a Korean population.,"Kang MW, Kim JE, Kang J, Kim S, Park J, Bae S, Kim YS, Choi JY, Cho JY, Han SS.","<h4>Background</h4>The heterogeneity of chronic kidney disease (CKD) and fragmented analysis methods hinder the precise identification of novel biomarkers. We addressed this challenge using two independent cohorts to integrate genomics and metabolomics, aiming to identify cause-specific biomarkers for CKD in the Korean population.<h4>Methods</h4>A longitudinal genome-wide association study using the Cox proportional hazards model was conducted using the Ansan and Ansung cohort. To validate these genomic biomarkers and integrate them with plasma metabolomics biomarkers, we utilized a hospital-b",4
38964323,10.1016/j.cmet.2024.06.007,2024,Cell metabolism,MED,Biological and genetic determinants of glycolysis: Phosphofructokinase isoforms boost energy status of stored red blood cells and transfusion outcomes.,"Nemkov T, Stephenson D, Earley EJ, Keele GR, Hay A, Key A, Haiman ZB, Erickson C, Dzieciatkowska M, Reisz JA, Moore A, Stone M, Deng X, Kleinman S, Spitalnik SL","Mature red blood cells (RBCs) lack mitochondria and thus exclusively rely on glycolysis to generate adenosine triphosphate (ATP) during aging in vivo or storage in blood banks. Here, we leveraged 13,029 volunteers from the Recipient Epidemiology and Donor Evaluation Study to identify associations between end-of-storage levels of glycolytic metabolites and donor age, sex, and ancestry-specific genetic polymorphisms in regions encoding phosphofructokinase 1, platelet (detected in mature RBCs); hexokinase 1 (HK1); and ADP-ribosyl cyclase 1 and 2 (CD38/BST1). Gene-metabolite associations were vali",3
39457388,10.3390/genes15101264,2024,Genes,MED,Metabolomic Changes Associated with AGXT2 Genotype Variants and Stone Formation in a Colony of Cats.,"Hall JA, Brockman JA, Brejda JJ, Jewell DE.","<h4>Objective</h4>The objective of this study was to assess serum chemistries and metabolomic parameters in cats with genetic variants of the alanine-glyoxylate aminotransferase 2 (AGXT2) gene to determine abnormalities associated with urolith formation and better understand effective approaches for the treatment of cats with uroliths.<h4>Methods</h4>AGXT2 genotypes of 445 cats in the colony at Hill's Pet Nutrition, Inc. (Topeka, KS, USA) were assessed in a genome-wide association study. Additionally, the serum chemistries and metabolic profiles of each cat were determined, along with their li",3
39596375,10.3390/ijms252212310,2024,International journal of molecular sciences,MED,Identifying the Shared Metabolite Biomarkers and Potential Intervention Targets for Multiple Sarcopenia-Related Phenotypes.,"Luo J, Li J, Wang W, Zhang R, Zhang D.","The relationship between circulating metabolites and sarcopenia-related phenotypes remains unclear. We explored the causality between circulating metabolites and sarcopenia-related phenotypes. Instrumental variables for the human metabolome were derived from the recently published GWAS, which included 690 plasma metabolites. Summary statistics for four sarcopenia phenotypes (whole-body lean mass (WBLM), usual walking pace, appendicular lean mass (ALM), and handgrip strength (HGS)) (both sexes, males and females) were obtained from relevant GWASs. We used MR to evaluate the association between ",3
40428280,10.3390/diagnostics15101287,2025,"Diagnostics (Basel, Switzerland)",MED,Immune Cells as Mediators of Lipidome Influence on Osteoporosis: Evidence from a Mediation Analysis.,"Xiao J, Zhou W, He J, Zhu Y, Zhang Y, Xiong L.","<b>Background</b>: Although clinical studies have indicated a possible association between dyslipidemia and osteoporosis, the underlying genetic basis and mechanistic pathways remain insufficiently defined. Most prior research has concentrated on conventional lipid markers, which are prone to confounding and limit causal inference. Exploring lipidomic profiles offers a more comprehensive view of lipid metabolism and may reveal novel genetic links beyond traditional lipid traits. Additionally, alterations in immune cell function, often triggered by metabolic disturbances, may contribute to oste",3
41275212,10.1186/s13073-025-01578-7,2025,Genome medicine,MED,Genetic atlas of plasma metabolome across 40 human common diseases: mapping causal metabolites to disease risk.,"Li Y, Cai Y, Ma Q, Yang X, He C, Xu Y, Zhang M, Lu Z, Chen C, Ning C, Liu B, Wei Y, Li X, Jin M, Zhu X, Li B, Zhu Y, Huang C, Miao X, Tian J.","<h4>Background</h4>Metabolites are closely linked to individual health and disease conditions. Identifying genetic factors influencing metabolite levels in specific diseases can enhance our understanding of disease etiology and informing precision medicine. This study aims to characterize the genetic architecture of metabolites in specific disease states and explore their potential biological functions.<h4>Methods</h4>We conducted a comprehensive genome-wide metabolite quantitative trait locus (metQTL) analysis of 249 plasma metabolites across 40 disease states, based on nuclear magnetic reson",3
39852371,10.3390/metabo15010028,2025,Metabolites,MED,DisCo P-ad: Distance-Correlation-Based <i><b>p</b></i>-Value Adjustment Enhances Multiple Testing Corrections for Metabolomics.,"Nandy D, Ghosh D, Kechris K.","<h4>Background</h4>Due to scientific advancements in high-throughput data production technologies, omics studies, such as genomics and metabolomics, often give rise to numerous measurements per sample/subject containing several noisy variables that potentially cloud the true signals relevant to the desired study outcome(s). Therefore, correcting for multiple testing is critical while performing any statistical test of significance to minimize the chances of false or missed discoveries. Such correction practice is commonplace in genome-wide association studies (GWAS) but is also becoming increa",3
40871658,10.3390/nu17162630,2025,Nutrients,MED,"A Genome-Wide Association Study of Circulating Serum Choline, Betaine, Dimethylglycine, and Their Ratios.","Louck LE, Klatt KC, Wallace TC, Ma J, Chung M.","<i>Background/Objectives:</i> Genetic variation has been thought to alter the human dietary requirement for choline and subsequent circulating levels of its metabolites betaine and dimethylglycine (DMG). The aim of this genome-wide association study (GWAS) was to identify single nucleotide polymorphisms (SNPs) associated with serum choline, betaine, and dimethylglycine (DMG) as well as choline-to-betaine and betaine-to-DMG ratios. <i>Methods:</i> Data from the Collaborative Study of Genes, Nutrients and Metabolites (CSGNM; <i>n</i> = 2402) were used to model individual associations of choline,",3
39792658,10.1126/sciadv.adr1725,2025,Science advances,MED,Reduced circulating sphingolipids and &lt;i&gt;CERS2&lt;/i&gt; activity are linked to T2D risk and impaired insulin secretion.,"Khan SR, Ye WW, Van JAD, Singh I, Rabiee Y, Rodricks KL, Zhang X, Nicholson RJ, Razani B, Summers SA, Futerman AH, Gunderson EP, Wheeler MB.","Gestational diabetes mellitus (GDM), a transient form of diabetes that resolves postpartum, is a major risk factor for type 2 diabetes (T2D) in women. While the progression from GDM to T2D is not fully understood, it involves both genetic and environmental components. By integrating clinical, metabolomic, and genome-wide association study (GWAS) data, we identified associations between decreased sphingolipid biosynthesis and future T2D, in part through the <i>rs267738</i> allele of the <i>CERS2</i> gene in Hispanic women shortly after a GDM pregnancy. To understand the impact of the <i>CERS2</",3
41518124,10.1097/mol.0000000000001023,2026,Current opinion in lipidology,MED,Genetic determinants of plasma lipids in Greenlanders.,"Hjerresen J, Jørsboe E, Andersen MK.","<h4>Purpose of review</h4>Greenlanders differ from other populations in terms of traditional lifestyle and genetic architecture. This might have a great impact on lipid levels in the population and the spectrum of genetic variants associated with lipid traits. Here, we review recent advances in lipid genetics in Greenlanders and highlight the potential of moving from single lipid trait analyses to more comprehensive lipidomic profiling.<h4>Recent findings</h4>Genetic association studies in the Greenlandic population have identified variants, including PCSK9 (rs12117661), LDLR (rs730882082), an",3
41974591,10.1111/1753-0407.70225,2026,Journal of diabetes,MED,Genomic Structural Equation Modeling Reveals Cardiovascular-Kidney-Metabolic Syndrome Genetic Architecture.,"Lu C, Li L, Chen J, Chang R, Dong H.","<h4>Background</h4>The genetic basis of cardiovascular-kidney-metabolic syndrome (CKMs) involves complex pleiotropy, necessitating analytical approaches capable of dissecting shared genetic architectures across multiple cardiometabolic traits.<h4>Methods</h4>We employed genomic structural equation modeling (genomic SEM) to integrate summary statistics from six cardiometabolic traits. The model was assessed using standard fit indices. Genome-wide association analyses were performed on 1,862,425 SNPs under stringent quality control measures, with LD Score regression applied to evaluate polygenic",3
41652150,10.1038/s41380-026-03464-z,2026,Molecular psychiatry,MED,A genetic atlas of relationships between circulating metabolites and liability to psychiatric conditions.,"Kiltschewskij DJ, Reay WR, Cairns MJ.","Observational studies have reported alteration of circulating metabolites across several psychiatric conditions, but these studies cannot resolve causal relationships. Emerging evidence suggests a genetic relationship exists between these traits requiring further investigation to identify clinically actionable biology. Here, we used the largest genome-wide association studies available to investigate genetic correlation and causal relationships between 10 psychiatric conditions and 249 circulating metabolites. This revealed 1,100 significantly correlated trait pairings, involving fatty acids, ",3
41478820,10.1016/j.tjpad.2025.100452,2026,The journal of prevention of Alzheimer's disease,MED,Multi-omics integration reveals shared genetic architecture between metabolic markers and gray matter atrophy in Alzheimer's Disease.,"Wang P, Wu X, Sun F, Zhang H, Jiang Y, Wang Q, Ding H, Zhou Y, Liu F, Liu H.","<h4>Background</h4>Alzheimer's disease (AD) is a progressive neurodegenerative disorder characterized by widespread gray matter volume (GMV) reductions. Emerging evidence links glucose and lipid metabolic dysregulation to AD pathophysiology. However, the extent to which AD-related GMV alterations and metabolic traits share a common genetic basis remains poorly understood.<h4>Objectives</h4>To explore the shared genetic architecture between GMV alterations in AD and metabolites related to glucose and lipid metabolism, aiming to provide biological insights into the prevention and treatment of AD",3
