pmid,doi,year,journal,source,title,authors,abstract,score
,10.1101/2024.07.30.24311254,2024,PPR,PPR,Pleiotropic and sex-specific genetic architecture of circulating metabolic markers,"van der Meer D, Rahman Z, Ottas A, Parekh P, Kutrolli G, Stinson S, Koromina M, Rokicki J, Sonderby I, Parker N, Tesfaye M, Hindley G, Rodevand L, Koch E, Steen","<h4>Background: </h4> Metabolites in plasma form biosignatures of a range of common complex human diseases. Mapping the genetic architecture and discovering variants with pleiotropic effects across metabolites can reveal underlying mechanisms and potential targets for personalized interventions. <h4>Methods:</h4> We performed univariate and multivariate genome-wide association studies (GWAS) on the Nightingale panel of 249 circulating plasma metabolic markers, across 207,836 White British UK Biobank participants (mean age 57.4 years, 53.7% female), with replication conducted across 27,509 UK B",9
40118068,10.1016/j.xgen.2025.100810,2025,Cell genomics,MED,Cross-ancestry analyses of Chinese and European populations reveal insights into the genetic architecture and disease implication of metabolites.,"Lin C, Xia M, Dai Y, Huang Q, Sun Z, Zhang G, Luo R, Peng Q, Li J, Wang X, Lin H, Gao X, Tang H, Shen X, Wang S, Jin L, Hao X, Zheng Y.","Differential susceptibilities to various diseases and corresponding metabolite variations have been documented across diverse ethnic populations, but the genetic determinants of these disparities remain unclear. Here, we performed large-scale genome-wide association studies of 171 directly quantifiable metabolites from a nuclear magnetic resonance-based metabolomics platform in 10,792 Han Chinese individuals. We identified 15 variant-metabolite associations, eight of which were successfully replicated in an independent Chinese population (n = 4,480). By cross-ancestry meta-analysis integrating",8
40973927,10.1038/s41467-025-62126-w,2025,Nature communications,MED,"Genetic architecture of plasma metabolome in 254,825 individuals.","Qiang YX, Wang YX, He XY, Deng YT, Ge YJ, Wu BS, Jia Y, Feng JF, Cheng W, Yu JT.","Circulating metabolites are crucial to biological processes underlying health and diseases, yet their genetic determinants remain incompletely understood. Here, we investigate the genetic architecture of nuclear magnetic resonance-based metabolomics, analyzing 249 metabolic measures and 64 biologically plausible ratios in 254,825 participants. We conduct a genome-wide association study (GWAS) identifying 24,438 independent variant-metabolite associations across 427 loci, with effect sizes highly concordant with 19 previous studies. Fine-mapping pinpoints 3610 putative causal associations, 785 ",8
,10.1101/2025.08.04.667775,2025,PPR,PPR,Metabolomics Ex/GWAS in the Amish reveals novel insights into cardiometabolic disease pathways,"Jallow MW, Tzoneva G, Ye B, Backman J, Zavala VA, Sosina O, Kapoor M, Verweij N, Landheer K, Geraghty B, Herman J, Marchini J, Locke A, Bovijn J, Nielsen J, Lot","<h4>ABSTRACT</h4> We conducted an exome and genome-wide association study (Ex/GWAS) of 1,015 metabolites in serum samples from 5,981 Amish adults. We identified 149 functional or likely functional genetic variants, based on CADD scores significantly associated ( P < 5.8 x 10 -8 ) with 519 metabolite levels, 69 of which were >10-fold enriched in the Amish versus Europeans in gnomAD. We discovered novel associations involving a PCK2 splice-donor variant (rs138881435) and metabolites important for energy metabolism and mitochondrial function. In UK Biobank participants, this variant was associate",8
,10.64898/2025.12.03.25341540,2025,PPR,PPR,Genetic Architecture of Circulating Metabolic Biomarkers Across Ancestral Populations,"Takeuchi Y, Koido M, He Y, Nakamura S, Liu X, Itokawa N, Tsuru H, Sagiya Y, Nagai A, Morisaki T, Matsuda K, Kamatani Y.","Circulating metabolite levels hold promise for disease risk prediction, yet the genetic architecture and cross-ancestry transferability remain incompletely characterized. Here, we conducted the largest genome-wide association study in East Asians to date, quantifying 248 blood metabolic biomarkers using nuclear magnetic resonance spectroscopy in 37,969 Japanese individuals. We identified eight novel associations and pinpointed rs75326924, causing CD36 deficiency, as a putative causal variant influencing average diameter for low-density lipoprotein particles. A cross-ancestry meta-analysis of 6",8
39389015,10.1016/j.xgen.2024.100657,2024,Cell genomics,MED,Genome-wide association study of maternal plasma metabolites during pregnancy.,"Liu S, Yao J, Lin L, Lan X, Wu L, He X, Kong N, Li Y, Deng Y, Xie J, Zhu H, Wu X, Li Z, Xiong L, Wang Y, Ren J, Qiu X, Zhao W, Gao Y, Chen Y, Su F, Zhou Y, Rao ","Metabolites are key indicators of health and therapeutic targets, but their genetic underpinnings during pregnancy-a critical period for human reproduction-are largely unexplored. Using genetic data from non-invasive prenatal testing, we performed a genome-wide association study on 84 metabolites, including 37 amino acids, 24 elements, 13 hormones, and 10 vitamins, involving 34,394 pregnant Chinese women, with sample sizes ranging from 6,394 to 13,392 for specific metabolites. We identified 53 metabolite-gene associations, 23 of which are novel. Significant differences in genetic effects betwe",7
,10.1101/2024.06.25.600593,2024,PPR,PPR,Meta-Analysis of Urinary Metabolite GWAS Studies Identifies Three Novel Genome-Wide Significant Loci,"Zaki JK, Tomasik J, McCune J, Scherman O, Bahn S.","Genome-wide association studies (GWAS) have substantially enhanced the understanding of genetic influences on phenotypic outcomes; however, realizing their full potential requires an aggregate analysis of numerous studies. Here we represent the first comprehensive meta-analysis of urinary metabolite GWAS studies, aiming to consolidate existing data on metabolite-SNP associations, evaluate consistency across studies, and unravel novel genetic links. Following an extensive literature review and data collection through the EMBL-EBI GWAS Catalog, PubMed, and metabolomix.com, we employed a sample s",7
,10.1101/2024.12.04.24318368,2024,PPR,PPR,Genome-wide Association Study of Complex Lipid Species: Results from the Population-based Rhineland Study,"Landstra EN, Imtiaz MA, Talevi V, Eichelmann F, Schulze MB, Aziz NA, Breteler MM.","The human lipidome comprises numerous complex lipids, dysregulation of which can contribute to the pathogenesis of a wide range of diseases. Despite the high heritability of parts of the lipidome, the genetic architecture of many circulating lipid species and their structure remains mostly unknown. Thus, we performed genome-wide association studies on 970 lipid species and 267 fatty acid composite measures using samples from the population-based Rhineland Study (n=6,096). We validated our findings using corresponding data from two other independent cohorts, including FinnGen (n=7,266) and EPIC",7
,10.1101/2024.11.11.24317110,2024,PPR,PPR,"Genome-wide association studies and multi-omics integrative analysis reveal novel loci and their molecular mechanisms for circulating polyunsaturated, monounsaturated, and saturated fatty acids","Sun Y, Xu H, Ye K.","Previous genome-wide association studies (GWAS) have identified genetic loci associated with the circulating levels of FAs, but the biological mechanisms of these genetic associations remain largely unexplored. Here, we conducted GWAS to identify additional genetic loci for 19 circulating fatty acid (FA) traits in UK Biobank participants of European ancestry (N = 239,268) and five other ancestries (N = 508 – 4,663). We leveraged the GWAS findings to characterize genetic correlations and colocalized regions among FAs, explore sex differences, examine FA loci influenced by lipoprotein metabolism",7
39556006,10.1002/epi4.13101,2025,Epilepsia open,MED,Cerebrospinal fluid metabolites as potential biomarkers for epilepsy: Insights from genome-wide association studies.,"Zhao Z, Xing N, Hou L.","<h4>Objectives</h4>While metabolic imbalances have been observed in individuals with epilepsy, the direct involvement of specific metabolites in the development of the condition remains underexplored. A comprehensive analysis of the causality between cerebrospinal fluid metabolites (CSF) and epilepsy is pivotal in discovering innovative therapeutic interventions and prophylactic approaches.<h4>Methods</h4>Summary data from genome-wide association studies (GWAS) of CSF metabolites and epilepsy subtypes were obtained separately. A total of 338 CSF metabolites were investigated as exposures, and ",7
39644095,10.1016/j.xhgg.2024.100390,2025,HGG advances,MED,Genome-wide association study reveals shared and distinct genetic architecture of fatty acids and oxylipins in the Hispanic Community Health Study/Study of Latinos.,"Downie CG, Highland HM, Alotaibi M, Welch BM, Howard AG, Cheng S, Miller N, Jain M, Kaplan RC, Lilly AG, Long T, Sofer T, Thyagarajan B, Yu B, North KE, Avery C","Bioactive fatty acid-derived oxylipin molecules play key roles mediating inflammation and oxidative stress. Circulating levels of fatty acids and oxylipins are influenced by environmental and genetic factors; characterizing the genetic architecture of bioactive lipids could yield new insights into underlying biology. We performed a genome-wide association study (GWAS) of 81 fatty acids and oxylipins in 11,584 Hispanic Community Health Study/Study of Latinos (HCHS/SOL) participants with genetic and lipidomic data measured at study baseline (58.6% female, mean age = 46.1 years (standard deviatio",7
40545721,10.1016/j.xhgg.2025.100470,2025,HGG advances,MED,GWAS and multi-omics integrative analysis reveal novel loci and their molecular mechanisms for circulating fatty acids.,"Sun Y, Xu H, Ye K.","Previous genome-wide association studies (GWAS) have identified genetic loci associated with the circulating levels of fatty acids (FAs), but the biological mechanisms of these genetic associations remain largely unexplored. Here, we conducted GWAS to identify additional genetic loci for 19 circulating FA traits in UK Biobank participants of European ancestry (n = 239,268) and five other ancestries (n = 508-4,663). We leveraged the GWAS findings to characterize genetic correlations and colocalized regions among FAs, explore sex differences, examine FA loci influenced by lipoprotein metabolism,",7
41295283,10.3390/metabo15110697,2025,Metabolites,MED,Metabolite Genome-Wide Association in Hispanics with Obesity Reveals Genetic Risk and Interactions with Dietary Factors for Type 2 Diabetes.,"Lai CQ, Parnell LD, Li Z, Noel SE, Bhupathiraju SN, Tucker KL, Ordovás JM.","<h4>Background</h4>Obesity is a leading cause of type 2 diabetes (T2D), with particularly high prevalence in Hispanic populations residing in the USA. However, how genetic variation influences obesity-related blood metabolite levels which, in turn, contribute to T2D progression, is not well understood. Our goal was to identify and understand genetic and dietary connections between obesity and T2D in a Hispanic cohort of older adults.<h4>Materials and methods</h4>We conducted a genome-wide association study on 13 specific metabolites previously associated with T2D and characteristic of individu",7
41024449,10.1002/oby.70045,2025,"Obesity (Silver Spring, Md.)",MED,Genetic Determinants of Fatty Acid Composition in Subcutaneous and Visceral Adipose Tissue.,"Ahmed A, Naz A, Thanaj M, Sorokin EP, Whitcher B, Bell JD, Thomas EL, Cule M, Yaghootkar H.","<h4>Objective</h4>Fatty acids in adipose tissue are key structural and metabolic regulators of cardiometabolic health, but the genetic architecture governing depot-specific composition in subcutaneous (SAT) and visceral adipose tissue (VAT) is not well defined.<h4>Methods</h4>We used MRI-derived estimates of fatty acid composition in SAT and VAT from 33,583 UK Biobank participants to perform genome-wide association studies. Functional annotation, fine mapping, colocalization, and expression QTL analyses were conducted to prioritize likely causal variants and explore mechanisms.<h4>Results</h4>",7
40595242,10.1038/s41598-025-07518-0,2025,Scientific reports,MED,Meta-analysis of urinary metabolite GWAS studies identifies novel genome-wide significant loci.,"Zaki JK, Tomasik J, McCune JA, Scherman OA, Bahn S.","Genome-wide association studies (GWAS) have substantially enhanced the understanding of genetic influences on phenotypic outcomes; however, realizing their full potential requires an aggregate analysis of numerous studies. Here we represent the first comprehensive meta-analysis of urinary metabolite GWAS studies, aiming to consolidate existing data on metabolite-SNP associations, evaluate consistency across studies, and unravel novel genetic links. Following an extensive literature review and data collection through the EMBL-EBI GWAS Catalog, PubMed, and metabolomix.com, we employed a sample s",7
42069741,10.1038/s41467-026-72542-1,2026,Nature communications,MED,Population-based genome-wide association study of plasma complex lipid species.,"Landstra EN, Imtiaz MA, Talevi V, Eichelmann F, Schulze MB, Aziz NA, Breteler MMB.","The human lipidome comprises numerous complex lipids, dysregulation of which can contribute to the pathogenesis of a wide range of diseases. Despite the high heritability of parts of the lipidome, the genetic architecture of many circulating lipid species and their structure remains mostly unknown. Thus, we perform genome-wide association studies on 970 lipid species and 267 fatty acid composite measures using samples from the population-based Rhineland Study (n = 6096). We validate our findings using corresponding data from two other independent cohorts, including FinnGen (n = 7266) and EPIC-",7
39528826,10.1038/s41588-024-01973-7,2024,Nature genetics,MED,Genetic architecture of cerebrospinal fluid and brain metabolite levels and the genetic colocalization of metabolites with human traits.,"Wang C, Yang C, Western D, Ali M, Wang Y, Phuah CL, Budde J, Wang L, Gorijala P, Timsina J, Ruiz A, Pastor P, Fernandez MV, Dominantly Inherited Alzheimer Netwo","Brain metabolism perturbation can contribute to traits and diseases. We conducted a genome-wide association study for cerebrospinal fluid (CSF) and brain metabolite levels, identifying 205 independent associations (47.3% new signals, containing 11 new loci) for 139 CSF metabolites, and 32 independent associations (43.8% new signals, containing 4 new loci) for 31 brain metabolites. Of these, 96.9% (CSF) and 71.4% (brain) of the new signals belonged to previously analyzed metabolites in blood or urine. We integrated the metabolite quantitative trait loci (MQTLs) with 23 neurological, psychiatric",6
,10.22541/au.173046800.03170735/v1,2024,PPR,PPR,Genome-wide association analysis provides insights into the regulatory mechanism of ω-3 fatty acids in oysters,"Li Q, Cong R, Wang C, Wang W, Zhang G, QI H, LI L.","As climate change impacts marine ecosystems, the production of ω-3 polyunsaturated fatty acids (PUFAs) is significantly declining. To enhance ω-3 PUFA production through genetic approaches, understanding the regulatory mechanisms is essential. Oysters, as representative bivalves, exhibit high levels of PUFAs. Two closely related species, Crassostrea gigas (adapted to cold climates) and Crassostrea angulata (adapted to warm climates), provide an opportunity to investigate the genetic and environmental effects of climate change on oysters and explore the regulatory mechanisms underlying ω-3 fatt",6
40972578,10.1016/j.ajhg.2025.08.022,2025,American journal of human genetics,MED,Genetic architecture and analysis practices of circulating metabolites in the NHLBI Trans-Omics for Precision Medicine Program.,"Wang N, Ockerman FP, Zhou LY, Grove ML, Alkis T, Barnard J, Bowler RP, Clish CB, Chung S, Drzymalla E, Evans AM, Franceschini N, Gerszten RE, Gillman MG, Hutton","Circulating metabolite levels partly reflect the state of human health and diseases and can be impacted by genetic determinants. Hundreds of loci associated with circulating metabolites have been identified; however, most findings focus on predominantly European ancestry or single-study analyses. Leveraging the rich metabolomics resources generated by the National Heart, Lung, and Blood Institute (NHLBI) Trans-Omics for Precision Medicine (TOPMed) Program, we harmonized and accessibly cataloged 1,729 circulating metabolites among 25,058 ancestrally diverse samples. From our comparison of multi",6
39972264,10.1186/s12864-025-11344-z,2025,BMC genomics,MED,Genome-wide association study of fat content and fatty acid composition of shea tree (Vitellaria paradoxa C.F. Gaertn subsp. paradoxa).,"Attikora AJP, Kouassi KA, Yao SDM, Dago DN, Silué S, De Clerck C, Diarrassouba N, Alabi T, Achigan-Dako EG, Fauconnier ML, Danthine S, Lassois L.","<h4>Background</h4>Fat content (FC) and fatty acids (FA) are the most important traits in shea tree breeding, controlled by several genes with relatively small effects. Therefore, determining the genes involved in the biosynthesis of such traits is crucial for improving oil quantity and quality and for the domestication process of the species. To identify the quantitative trait nucleotides (QTNs) controlling FC and FA, we conducted a multi-locus genome-wide association study (GWAS) using six multi-locus GWAS methods for FC and FA in 122 superior shea trees (SSTs). SSTs were genotyped using DAr",6
,10.21203/rs.3.rs-5590960/v1,2025,PPR,PPR,Simulating Metabolic Pathways to Enhance Interpretations of Metabolome Genome-Wide Association Studies,"Kodate S, Sato M, Hishinuma E, Kojima K, Motoike IN, Study Group TST, Koshiba S, Yamamoto M, Yamada KD, Kinoshita K.","<title>Abstract</title> <p>Advancements in large-scale analysis of metabolites in human peripheral blood samples revealed the links between metabolite concentrations and genetic variations. This field is known as metabolome-genome-wide association study (MGWAS). Although MGWAS is a powerful tool, it has some limitations, particularly in terms of the number of metabolites that can be measured. Whether the observed associations are directly due to genetic variation or indirectly due to changes in unmeasured metabolites is unclear. To address this, we used simulations of metabolic pathway models ",6
40215300,10.1126/sciadv.adp4532,2025,Science advances,MED,On the analysis of metabolite quantitative trait loci: Impact of different data transformations and study designs.,"Lee S, Kelly RS, Mendez KM, Prokopenko D, Hahn G, Lutz SM, Celedón JC, Clish CB, Weiss ST, Lange C, Lasky-Su JA, Hecker J, NHLBI Trans-Omics for Precision Medic","Metabolomic genome-wide association studies (mGWASs), or metabolomic quantitative trait locus (metQTL) analyses, are gaining growing attention. However, robust methods and analysis guidelines, vital to address the complexity of metabolomic data, remain to be established. Here, we use whole-genome sequencing and metabolomic data from two independent studies to compare different approaches. We adopted three popular data transformation methods for metabolite levels-(i) log<sub>10</sub> transformation, (ii) rank inverse normal transformation, and (iii) a fully adjusted two-step procedure-and compa",6
40379784,10.1038/s41598-025-01634-7,2025,Scientific reports,MED,Simulating metabolic pathways to enhance interpretations of metabolome genome-wide association studies.,"Kodate S, Sato M, Hishinuma E, Kojima K, Motoike IN, ToMMo Study Group, Koshiba S, Yamamoto M, Yamada KD, Kinoshita K.","Advancements in large-scale analysis of metabolites in human peripheral blood samples revealed the links between metabolite concentrations and genetic variations. This field is known as metabolome-genome-wide association study (MGWAS). Although MGWAS is a powerful tool, it has some limitations, particularly in terms of the number of metabolites that can be measured. Whether the observed associations are directly due to genetic variation or indirectly due to changes in unmeasured metabolites is unclear. To address this, we used simulations of metabolic pathway models to investigate the influenc",6
40113840,10.1038/s41598-025-93415-5,2025,Scientific reports,MED,Genome-wide associations of sweetpotato metabolites enhance genomic prediction and identify genes in metabolic and regulatory pathways.,"Rickman TE, Adams AK, Wadl PA, Yencho GC, Olukolu BA.","Global sweetpotato production is increasing due to its health benefits, including high levels of complex carbohydrates and bioactive compounds. To explore the genetic basis of carbohydrates and carotenoids, we conducted a genome-wide association study (GWAS) using diverse sweetpotato accessions, two decades of phenotypic data, and 252,975 dosage-based SNPs and INDELs. Our findings confirmed a negative correlation between dry matter and β-carotene and identified interconnected metabolic pathways regulating multiple traits. Notably, phytoene synthase, involved in carotene biosynthesis, was assoc",6
39694057,10.1055/a-2504-0903,2025,Thrombosis and haemostasis,MED,Long-Chain Polysaturated Fatty Acid in Atrial Fibrillation-Associated Stroke: Lipidomic-GWAS Study.,"Jung Y, Kim B, Kim CK, Won HH, Chae SH, Oh K, Shin MJ, Hwang GS, Seo WK.","This study aimed to explore the relationship between lipidomic domains, particularly free fatty acids (FFAs), and the presence of atrial fibrillation (AF) in patients with acute stroke, and to identify mechanisms of AF-associated stroke through genetic studies.A total of 483 stroke patients without AF (<i>n</i> = 391) and with AF (<i>n</i> = 92) were selected from a prospectively collected stroke registry. Lipidomic profiling was conducted, and the lipid components associated with AF were explored using fold-change analyses and clustering. Genotyping was conducted through trait comparison. Col",6
41067896,10.12200/j.issn.1003-0034.20241216,2025,Zhongguo gu shang = China journal of orthopaedics and traumatology,MED,[Integrating genomics and metabolomics to reveal the genetic basis and potential therapeutic targets of diabetic foot].,"Zhang Y, Chen C, Li ZD, Zhou HC, Li B, Yang YF.","<h4>Objective</h4>To screen out the key metabolites related to diabetic foot (DF) by integrating genome-wide association studies (GWAS) and metabolome genome-wide association studies (mGWAS).<h4>Methods</h4>The literature databases such as PubMed and China national knowledge infrastructure(CNKI), as well as genomics databases such as PAN UKBB, FinnGen, and IEU Open GWAS were systematically retrieved from database estobilishment to November 2024 on DF-related single nucleotide polymorphisms and genome-wide association studies. DF-single nucleotide polymorphism-metabolite network was constructed",6
41938174,10.1002/mco2.70718,2026,MedComm,MED,Identification of Blood Pressure-Associated Metabolites by Integrating Metabolomic and Genetic Analysis.,"Liu Y, Cheng C, Pan XF, Shao W, Zhou D, Zhu Y.",This study aimed to identify blood pressure-associated metabolites and explore their underlying pathways using multiomics data from 1188 Chinese participants. Serum metabolite levels were profiled using untargeted and widely targeted metabolomic technologies. The associations of metabolites as well as ratios with blood pressure were assessed using generalized linear models (GLM). Targeted metabolomics was used to replicate a subset of metabolites. Genome-wide association studies (GWAS) were performed on all metabolites identified. Potential causality was examined using two-sample Mendelian ran,6
42162431,10.1038/s41586-026-10532-5,2026,Nature,MED,"Genetic analysis of circulating metabolic traits in 619,372 individuals.","Tambets R, Jesse M, Kronberg J, van der Graaf A, Abner E, Võsa U, Rahu I, Taba N, Kolde A, Yarish D, Abdullayeva S, Alekseienko A, Veidenberg A, Estonian Bioban","Interpreting the association of genetic variants with complex traits can be improved by gaining a greater understanding of the molecular consequences of these variants. Although genome-wide association studies (GWAS) for complex diseases routinely profile over one million individuals<sup>1-5</sup>, studies of molecular traits have lagged behind. Here we performed a GWAS meta-analysis for 249 circulating metabolic traits in the Estonian Biobank and the UK Biobank in up to 619,372 individuals. We identified 88,127 common and low-frequency locus-trait associations from 8,398 loci that converged o",6
38648753,10.1093/jnci/djae089,2024,Journal of the National Cancer Institute,MED,Systematic investigation of genetically determined plasma and urinary metabolites to discover potential interventional targets for colorectal cancer.,"Sun J, Zhao J, Zhou S, Li X, Li T, Wang L, Yuan S, Chen D, Law PJ, Larsson SC, Farrington SM, Houlston RS, Dunlop MG, Theodoratou E, Li X.","<h4>Background</h4>We aimed to identify plasma and urinary metabolites related to colorectal cancer (CRC) risk and elucidate their mediator role in the associations between modifiable risk factors and CRC.<h4>Methods</h4>Metabolite quantitative trait loci were derived from 2 published metabolomics genome-wide association studies, and summary-level data were extracted for 651 plasma metabolites and 208 urinary metabolites. Genetic associations with CRC were obtained from a large-scale genome-wide association study meta-analysis (100 204 cases, 154 587 controls) and the FinnGen cohort (4957 case",5
